{
  "schema_version": "1.0.0",
  "id": "resource.data-analytics-ml.analytical-model-metric-semantics.reference",
  "version": "1.0.0",
  "title": "분석 모델·지표 의미계약 공식·1차 출처 Reference",
  "description": "정규 Unit의 정의·범위와 판정 기준을 뒷받침하는 공개 Reference입니다. 상세 교재나 독립 평가자료를 대신하지 않습니다.",
  "resource_type": "external_reference",
  "owner": {
    "kind": "unit",
    "id": "unit.data-analytics-ml.analytical-model-metric-semantics",
    "version": "1.0.0"
  },
  "location": {
    "kind": "external",
    "url": "https://www.w3.org/TR/vocab-data-cube/"
  },
  "learning_outcome_ids": [
    "outcome.data-analytics-ml.analytical-model-metric-semantics.d0",
    "outcome.data-analytics-ml.analytical-model-metric-semantics.d2"
  ],
  "estimated_minutes": 30,
  "language": "ko",
  "tags": [
    "reference",
    "promotion-evidence"
  ],
  "requirements": {
    "platforms": [
      "web-browser"
    ],
    "network_required": true
  },
  "provenance": {
    "origin": "external",
    "sources": [
      {
        "title": "The RDF Data Cube Vocabulary",
        "publisher": "World Wide Web Consortium",
        "source_type": "official_spec",
        "url": "https://www.w3.org/TR/vocab-data-cube/",
        "source_version": "W3C Recommendation 2014-01-16",
        "checked_at": "2026-07-29"
      },
      {
        "title": "SDMX 3.1 Technical Specifications",
        "publisher": "SDMX Sponsors",
        "source_type": "official_spec",
        "url": "https://sdmx.org/standards-2/",
        "source_version": "SDMX 3.1, 2025-05",
        "checked_at": "2026-07-29"
      },
      {
        "title": "ISO/IEC 11179-4:2004 Information technology — Metadata registries — Part 4: Formulation of data definitions",
        "publisher": "International Organization for Standardization",
        "source_type": "standard",
        "url": "https://www.iso.org/standard/35346.html",
        "source_version": "ISO/IEC 11179-4:2004, confirmed current 2015",
        "checked_at": "2026-07-29"
      },
      {
        "title": "Measures",
        "publisher": "dbt Labs",
        "source_type": "official_docs",
        "url": "https://docs.getdbt.com/docs/build/measures",
        "checked_at": "2026-07-29"
      }
    ]
  },
  "accessibility": {
    "status": "unverified",
    "standard": "WCAG 2.2 AA",
    "features": [],
    "alternative_resource_refs": [],
    "note": "외부 출처의 접근성은 재검토가 필요합니다."
  },
  "verification": {
    "status": "partial",
    "checked_at": "2026-07-29",
    "commands": [],
    "expected_outputs": [
      "출처가 Unit의 정의·범위·판정 기준을 뒷받침하는지 확인한 기록"
    ],
    "evidence_paths": [],
    "note": "URL·근거 범위만 검토했으며 학습자료로서의 완전성과 평가 타당성은 아직 검증하지 않았습니다."
  },
  "lifecycle": {
    "status": "cataloged",
    "owner": "AX learning workspace",
    "last_reviewed_at": "2026-07-29",
    "review_due_at": "2026-10-29",
    "note": "Candidate 승격 시 등록한 공개 Reference입니다."
  },
  "extensions": {
    "promoted_from": {
      "kind": "capability_candidate",
      "id": "candidate.data-analytics-ml.analytical-model-metric-semantics",
      "version": "1.0.0"
    }
  }
}
