{
  "schema_version": "1.0.0",
  "id": "resource.human-ai-experience.social-cue-anthropomorphism-boundary-reference",
  "version": "1.0.0",
  "title": "AI 사회적 단서·의인화 경계 가이드",
  "description": "이름·1인칭·목소리·감정표현·사회적 역할 같은 단서가 AI 역량·책임·신뢰 mental model에 미치는 경계를 설명하는 정규 D0 Resource입니다.",
  "resource_type": "external_reference",
  "owner": {
    "kind": "unit",
    "id": "unit.human-ai-experience.mental-model-capability-onboarding",
    "version": "1.0.0"
  },
  "location": {
    "kind": "external",
    "url": "https://research.google/pubs/believing-anthropomorphism-examining-the-role-of-anthropomorphic-cues-on-user-trust-in-large-language-models/"
  },
  "learning_outcome_ids": [
    "outcome.human-ai-experience.mental-model-capability-onboarding.d0"
  ],
  "estimated_minutes": 30,
  "language": "ko",
  "tags": [
    "social",
    "cue",
    "anthropomorphism",
    "boundary",
    "boundary-guide"
  ],
  "requirements": {
    "platforms": [
      "web-browser"
    ],
    "network_required": true
  },
  "provenance": {
    "origin": "external",
    "sources": [
      {
        "title": "Believing Anthropomorphism: Examining the Role of Anthropomorphic Cues on User Trust in Large Language Models",
        "publisher": "Google Research",
        "source_type": "primary_research",
        "url": "https://research.google/pubs/believing-anthropomorphism-examining-the-role-of-anthropomorphic-cues-on-user-trust-in-large-language-models/",
        "checked_at": "2026-07-30",
        "source_version": "Extended Abstracts of CHI 2024"
      },
      {
        "title": "People + AI Guidebook: Mental Models",
        "publisher": "Google People + AI Research",
        "source_type": "official_docs",
        "url": "https://pair.withgoogle.com/guidebook-v2/chapter/mental-models/",
        "checked_at": "2026-07-30",
        "source_version": "updated 2021-05-18"
      },
      {
        "title": "AI Risk Management and Human-AI Interaction",
        "publisher": "National Institute of Standards and Technology",
        "source_type": "official_docs",
        "url": "https://airc.nist.gov/airmf-resources/airmf/appendices/app-c-ai-risk-management-and-human-ai-interaction/",
        "checked_at": "2026-07-30",
        "source_version": "AI RMF 1.0 Appendix C"
      }
    ]
  },
  "accessibility": {
    "status": "unverified",
    "standard": "WCAG 2.2 AA",
    "features": [],
    "alternative_resource_refs": [],
    "note": "외부 출처의 접근성은 재검토가 필요합니다."
  },
  "verification": {
    "status": "partial",
    "checked_at": "2026-07-30",
    "commands": [],
    "expected_outputs": [
      "이름·1인칭·목소리·공감표현을 근거로 지원되지 않은 인간 속성을 추론한 사례를 식별하고 적절한 경계 설명으로 수정합니다."
    ],
    "evidence_paths": [],
    "note": "사회적 단서와 실제 역량·의도·감정·책임을 구분하는 D0 경계입니다. 근거 범위는 미국 성인 2,165명, pseudo-LLM, 단기 상호작용, text·speech·1인칭 단서이며 아동·취약 사용자·장기 사용·다문화·감정표현·avatar·사회적 역할 전반으로 일반화하지 않습니다. companion·아동·취약 사용자·정신건강·치료·조작·법적 의무·고위험 적용은 Human-AI 일반 UX 실습에서 제외하고 보안·법무·윤리 또는 해당 분야 전문가에게 이관합니다."
  },
  "lifecycle": {
    "status": "cataloged",
    "owner": "AX learning workspace",
    "last_reviewed_at": "2026-07-30",
    "review_due_at": "2026-10-30",
    "note": "candidate.human-ai-experience.social-cue-anthropomorphism-boundary-guide@1.0.0의 승인 결과를 정규 D0 Resource 메타데이터로 등록했습니다. 30분은 공개 Reference 검토 가설이며 상세 교재·독립 평가 타당성·파일럿과 학습효과는 아직 검증하지 않았습니다."
  },
  "extensions": {
    "promoted_from": {
      "kind": "capability_candidate",
      "id": "candidate.human-ai-experience.social-cue-anthropomorphism-boundary-guide",
      "version": "1.0.0"
    },
    "promotion_context": {
      "work_package_id": "wp.human-ai-experience.breadth-a",
      "promoted_at": "2026-07-30"
    },
    "evidence_claims": [
      {
        "id": "evidence.human-ai-experience.social-cue-anthropomorphism-boundary-guide.anthro",
        "title": "Believing Anthropomorphism: Examining the Role of Anthropomorphic Cues on User Trust in Large Language Models",
        "publisher": "Google Research",
        "source_type": "primary_research",
        "url": "https://research.google/pubs/believing-anthropomorphism-examining-the-role-of-anthropomorphic-cues-on-user-trust-in-large-language-models/",
        "published_at": "2024-05-09",
        "source_version": "Extended Abstracts of CHI 2024",
        "checked_at": "2026-07-29",
        "claim_scope": "LLM의 의인화 단서와 사용자 신뢰 관계를 실험적으로 조사한 특정 연구 범위를 지지하며 보편 효과는 지지하지 않습니다.",
        "supports": [
          "definition",
          "risk"
        ]
      },
      {
        "id": "evidence.human-ai-experience.social-cue-anthropomorphism-boundary-guide.pair-mental",
        "title": "People + AI Guidebook: Mental Models",
        "publisher": "Google People + AI Research",
        "source_type": "official_docs",
        "url": "https://pair.withgoogle.com/guidebook-v2/chapter/mental-models/",
        "source_version": "updated 2021-05-18",
        "checked_at": "2026-07-29",
        "claim_scope": "AI를 사람처럼 소개할 때 잘못된 mental model과 기대가 형성될 수 있는 실무 경계를 지지합니다.",
        "supports": [
          "scope",
          "work_relevance"
        ]
      },
      {
        "id": "evidence.human-ai-experience.social-cue-anthropomorphism-boundary-guide.nist-hai",
        "title": "AI Risk Management and Human-AI Interaction",
        "publisher": "National Institute of Standards and Technology",
        "source_type": "official_docs",
        "url": "https://airc.nist.gov/airmf-resources/airmf/appendices/app-c-ai-risk-management-and-human-ai-interaction/",
        "published_at": "2023-01-26",
        "source_version": "AI RMF 1.0 Appendix C",
        "checked_at": "2026-07-29",
        "claim_scope": "인간 역할·책임과 AI 시스템의 역할을 명확히 구분해야 하는 위험관리 맥락을 지지합니다.",
        "supports": [
          "risk",
          "scope"
        ]
      }
    ],
    "boundary_note": "사회적 단서와 실제 역량·의도·감정·책임을 구분하는 D0 경계입니다. 근거 범위는 미국 성인 2,165명, pseudo-LLM, 단기 상호작용, text·speech·1인칭 단서이며 아동·취약 사용자·장기 사용·다문화·감정표현·avatar·사회적 역할 전반으로 일반화하지 않습니다. companion·아동·취약 사용자·정신건강·치료·조작·법적 의무·고위험 적용은 Human-AI 일반 UX 실습에서 제외하고 보안·법무·윤리 또는 해당 분야 전문가에게 이관합니다."
  }
}
