{
  "schema_version": "1.0.0",
  "id": "resource.integration-automation.business-rule-decision-automation.reference",
  "version": "1.0.0",
  "title": "비즈니스 규칙·의사결정표 자동화 공식·1차 출처 Reference",
  "description": "정규 Unit의 정의·범위와 판정 기준을 뒷받침하는 공개 Reference입니다. 상세 교재나 독립 평가자료를 대신하지 않습니다.",
  "resource_type": "external_reference",
  "owner": {
    "kind": "unit",
    "id": "unit.integration-automation.business-rule-decision-automation",
    "version": "1.0.0"
  },
  "location": {
    "kind": "external",
    "url": "https://www.omg.org/spec/DMN/1.5/"
  },
  "learning_outcome_ids": [
    "outcome.integration-automation.business-rule-decision-automation.d0",
    "outcome.integration-automation.business-rule-decision-automation.d2"
  ],
  "estimated_minutes": 30,
  "language": "ko",
  "tags": [
    "reference",
    "promotion-evidence"
  ],
  "requirements": {
    "platforms": [
      "web-browser"
    ],
    "network_required": true
  },
  "provenance": {
    "origin": "external",
    "sources": [
      {
        "title": "Decision Model and Notation Version 1.5",
        "publisher": "Object Management Group",
        "source_type": "official_spec",
        "url": "https://www.omg.org/spec/DMN/1.5/",
        "source_version": "1.5",
        "checked_at": "2026-07-29"
      },
      {
        "title": "RIF Core Dialect (Second Edition)",
        "publisher": "World Wide Web Consortium",
        "source_type": "official_spec",
        "url": "https://www.w3.org/TR/rif-core/",
        "source_version": "W3C Recommendation 2013-02-05",
        "checked_at": "2026-07-29"
      }
    ]
  },
  "accessibility": {
    "status": "unverified",
    "standard": "WCAG 2.2 AA",
    "features": [],
    "alternative_resource_refs": [],
    "note": "외부 출처의 접근성은 재검토가 필요합니다."
  },
  "verification": {
    "status": "partial",
    "checked_at": "2026-07-29",
    "commands": [],
    "expected_outputs": [
      "출처가 Unit의 정의·범위·판정 기준을 뒷받침하는지 확인한 기록"
    ],
    "evidence_paths": [],
    "note": "URL·근거 범위만 검토했으며 학습자료로서의 완전성과 평가 타당성은 아직 검증하지 않았습니다."
  },
  "lifecycle": {
    "status": "cataloged",
    "owner": "AX learning workspace",
    "last_reviewed_at": "2026-07-29",
    "review_due_at": "2026-10-29",
    "note": "Candidate 승격 시 등록한 공개 Reference입니다."
  },
  "extensions": {
    "promoted_from": {
      "kind": "capability_candidate",
      "id": "candidate.integration-automation.business-rule-decision-automation",
      "version": "1.0.0"
    }
  }
}
