{
  "schema_version": "1.0.0",
  "id": "resource.example.replace-me.lab",
  "version": "1.0.0",
  "title": "교체: 학습자료 제목",
  "description": "교체: 자료가 수행시키는 활동, 입력, 출력과 검증 범위를 설명합니다.",
  "resource_type": "lab",
  "owner": {
    "kind": "unit",
    "id": "unit.example.replace-me",
    "version": "1.0.0"
  },
  "location": {
    "kind": "local",
    "path": "catalog/items/unit.example.replace-me/resources/lab/content.md"
  },
  "learning_outcome_ids": [
    "outcome.example.replace-me.guided",
    "outcome.example.replace-me.apply"
  ],
  "estimated_minutes": 90,
  "language": "ko",
  "tags": [
    "lab",
    "transfer-task"
  ],
  "requirements": {
    "platforms": [
      "replace-me"
    ],
    "network_required": false
  },
  "provenance": {
    "origin": "original",
    "sources": [
      {
        "title": "교체: 이 자료의 사실·절차를 뒷받침하는 공식 출처",
        "publisher": "교체: 발행기관",
        "source_type": "official_docs",
        "url": "https://example.com/replace-me",
        "source_version": "교체: 버전 또는 기준일",
        "checked_at": "2026-07-26"
      }
    ],
    "license": "LicenseRef-AX-Internal"
  },
  "accessibility": {
    "status": "unverified",
    "standard": "WCAG 2.2 AA",
    "features": [],
    "alternative_resource_refs": [],
    "note": "교체: 확인한 접근성 기능과 미확인 범위를 기록합니다."
  },
  "verification": {
    "status": "unverified",
    "commands": [],
    "expected_outputs": [
      "교체: 학습자가 제출해야 할 산출물 또는 자동검사 결과"
    ],
    "evidence_paths": [],
    "note": "교체: 파일 무결성, 실행, 내용 정확성, 평가 타당성 중 검증한 범위를 구분합니다."
  },
  "lifecycle": {
    "status": "cataloged",
    "owner": "교체: 유지관리 책임자",
    "last_reviewed_at": "2026-07-26",
    "review_due_at": "2026-10-26"
  }
}
